{
  "$schema": "../../schemas/protocol_definition.schema.json",
  "format": "IC10_PROTOCOL_DEFINITION_V1",
  "protocol_id": "ic10.stack.material-transfer-executor.v1",
  "name": "MaterialTransferExecutor v1",
  "transport": "ic-housing-stack",
  "contract": "MaterialTransferExecutor",
  "magic": -1929928026,
  "abi": 1,
  "header_bases": [
    0
  ],
  "canonical_refs": [],
  "layout": [
    {
      "cells": "S14",
      "start": 14,
      "end": 14,
      "name": "ActiveEpoch",
      "role": "epoch"
    },
    {
      "cells": "S15",
      "start": 15,
      "end": 15,
      "name": "CompletedEpoch",
      "role": "epoch"
    },
    {
      "cells": "S16",
      "start": 16,
      "end": 16,
      "name": "ExecutionStatus",
      "role": "state",
      "description": "1 completed, 0 active or idle, -1 failed"
    },
    {
      "cells": "S17",
      "start": 17,
      "end": 17,
      "name": "ObservedRate",
      "role": "result"
    },
    {
      "cells": "S18",
      "start": 18,
      "end": 18,
      "name": "BatchElapsedTicks",
      "role": "result"
    },
    {
      "cells": "S19",
      "start": 19,
      "end": 19,
      "name": "PublicationGeneration",
      "role": "generation"
    }
  ],
  "provider_interfaces": [
    {
      "source": "ic10/material-grid/material_transfer_executor_v1_0.ic10",
      "header_base": 0,
      "readable_ranges": [],
      "writable_ranges": [],
      "fields": [
        {
          "address": 0,
          "name": "Header@S0.Magic",
          "value_type": "hash",
          "semantic_source": "protocol-header",
          "access": [
            "self-write"
          ],
          "const": -1929928026
        },
        {
          "address": 1,
          "name": "Header@S0.ABI",
          "value_type": "integer",
          "semantic_source": "protocol-header",
          "access": [
            "self-write"
          ],
          "const": 1
        },
        {
          "address": 2,
          "name": "S2",
          "value_type": "number",
          "semantic_source": "unresolved",
          "access": [
            "self-write"
          ],
          "const": 32
        },
        {
          "address": 8,
          "name": "S8",
          "value_type": "number",
          "semantic_source": "unresolved",
          "access": [
            "self-read",
            "self-write"
          ]
        },
        {
          "address": 9,
          "name": "S9",
          "value_type": "number",
          "semantic_source": "unresolved",
          "access": [
            "self-read",
            "self-write"
          ]
        },
        {
          "address": 10,
          "name": "S10",
          "value_type": "number",
          "semantic_source": "unresolved",
          "access": [
            "self-read",
            "self-write"
          ]
        },
        {
          "address": 11,
          "name": "S11",
          "value_type": "number",
          "semantic_source": "unresolved",
          "access": [
            "self-write"
          ]
        },
        {
          "address": 12,
          "name": "S12",
          "value_type": "number",
          "semantic_source": "unresolved",
          "access": [
            "self-read",
            "self-write"
          ]
        },
        {
          "address": 13,
          "name": "S13",
          "value_type": "number",
          "semantic_source": "unresolved",
          "access": [
            "self-read",
            "self-write"
          ]
        },
        {
          "address": 14,
          "name": "ActiveEpoch",
          "value_type": "integer",
          "semantic_source": "protocol-layout",
          "access": [
            "self-read",
            "self-write"
          ],
          "role": "epoch"
        },
        {
          "address": 15,
          "name": "CompletedEpoch",
          "value_type": "integer",
          "semantic_source": "protocol-layout",
          "access": [
            "self-write"
          ],
          "role": "epoch"
        },
        {
          "address": 16,
          "name": "ExecutionStatus",
          "value_type": "enum",
          "semantic_source": "protocol-layout",
          "access": [
            "self-write"
          ],
          "role": "state",
          "description": "1 completed, 0 active or idle, -1 failed"
        },
        {
          "address": 17,
          "name": "ObservedRate",
          "value_type": "number",
          "semantic_source": "protocol-layout",
          "access": [
            "self-write"
          ],
          "role": "result"
        },
        {
          "address": 18,
          "name": "BatchElapsedTicks",
          "value_type": "number",
          "semantic_source": "protocol-layout",
          "access": [
            "self-write"
          ],
          "role": "result"
        },
        {
          "address": 19,
          "name": "PublicationGeneration",
          "value_type": "integer",
          "semantic_source": "protocol-layout",
          "access": [
            "self-read",
            "self-write"
          ],
          "role": "generation"
        },
        {
          "address": 31,
          "name": "S31",
          "value_type": "number",
          "semantic_source": "unresolved",
          "access": [
            "self-read",
            "self-write"
          ],
          "const": -1929928026
        }
      ],
      "behavior": {
        "publication_rules": [],
        "restart": {
          "mode": "preserved-unless-overwritten",
          "source": "static-entry-path-analysis"
        },
        "invariants": [
          {
            "id": "header.s0.magic",
            "kind": "cell-equals",
            "address": 0,
            "equals": -1929928026,
            "source": "generated-protocol-header"
          },
          {
            "id": "header.s0.abi",
            "kind": "cell-equals",
            "address": 1,
            "equals": 1,
            "source": "generated-protocol-header"
          }
        ]
      }
    }
  ],
  "consumer_interfaces": [
    {
      "source": "ic10/material-grid/material_resource_link_v1_0.ic10",
      "endpoint": {
        "kind": "device-port",
        "value": "d4"
      },
      "header_base": 0,
      "literal_reads": [
        0,
        15,
        16,
        17,
        18,
        19
      ],
      "literal_writes": [],
      "dynamic_read_ranges": [],
      "dynamic_write_ranges": [],
      "dynamic_read_range_source": "none",
      "dynamic_write_range_source": "none",
      "constraints": [
        {
          "address": 0,
          "operator": "equals",
          "value": -1929928026
        }
      ],
      "publication_requirements": []
    }
  ]
}
