{
  "$schema": "../../schemas/protocol_definition.schema.json",
  "format": "IC10_PROTOCOL_DEFINITION_V1",
  "protocol_id": "ic10.stack.job-inventory-preflight.v1",
  "name": "JobInventoryPreflight v1",
  "transport": "ic-housing-stack",
  "contract": "JobInventoryPreflight",
  "magic": 1304257902,
  "abi": 1,
  "header_bases": [
    0
  ],
  "canonical_refs": [],
  "layout": [
    {
      "cells": "S15",
      "start": 15,
      "end": 15,
      "name": "JobType",
      "role": "request"
    },
    {
      "cells": "S16",
      "start": 16,
      "end": 16,
      "name": "Identity",
      "role": "request"
    },
    {
      "cells": "S17",
      "start": 17,
      "end": 17,
      "name": "RequestedQuantity",
      "role": "request"
    },
    {
      "cells": "S18",
      "start": 18,
      "end": 18,
      "name": "RequestToken",
      "role": "request_token"
    },
    {
      "cells": "S19",
      "start": 19,
      "end": 19,
      "name": "ResponseToken",
      "role": "response_token"
    },
    {
      "cells": "S20",
      "start": 20,
      "end": 20,
      "name": "Status",
      "role": "state",
      "description": "1 satisfied, 2 lower-bound only, 3 deficit, -2 overflow, -1 invalid"
    },
    {
      "cells": "S21",
      "start": 21,
      "end": 21,
      "name": "InputOrdinal",
      "role": "result",
      "description": "the input the deficit was found on"
    },
    {
      "cells": "S22",
      "start": 22,
      "end": 22,
      "name": "InputResourceType",
      "role": "result"
    },
    {
      "cells": "S23",
      "start": 23,
      "end": 23,
      "name": "RequiredTotal",
      "role": "result"
    },
    {
      "cells": "S24",
      "start": 24,
      "end": 24,
      "name": "QuotedTotal",
      "role": "result"
    },
    {
      "cells": "S25",
      "start": 25,
      "end": 25,
      "name": "Deficit",
      "role": "result"
    },
    {
      "cells": "S26",
      "start": 26,
      "end": 26,
      "name": "QuoteFingerprintA",
      "role": "result"
    },
    {
      "cells": "S27",
      "start": 27,
      "end": 27,
      "name": "QuoteFingerprintB",
      "role": "result"
    }
  ],
  "provider_interfaces": [
    {
      "source": "ic10/dependency-planning/job_inventory_preflight_v1_0.ic10",
      "header_base": 0,
      "readable_ranges": [],
      "writable_ranges": [],
      "fields": [
        {
          "address": 0,
          "name": "Header@S0.Magic",
          "value_type": "hash",
          "semantic_source": "protocol-header",
          "access": [
            "self-write"
          ],
          "const": 1304257902
        },
        {
          "address": 1,
          "name": "Header@S0.ABI",
          "value_type": "integer",
          "semantic_source": "protocol-header",
          "access": [
            "self-write"
          ],
          "const": 1
        },
        {
          "address": 2,
          "name": "S2",
          "value_type": "number",
          "semantic_source": "unresolved",
          "access": [
            "self-write"
          ],
          "const": 0
        },
        {
          "address": 15,
          "name": "JobType",
          "value_type": "hash",
          "semantic_source": "protocol-layout",
          "access": [
            "self-read"
          ],
          "role": "request"
        },
        {
          "address": 16,
          "name": "Identity",
          "value_type": "hash",
          "semantic_source": "protocol-layout",
          "access": [
            "self-read"
          ],
          "role": "request"
        },
        {
          "address": 17,
          "name": "RequestedQuantity",
          "value_type": "number",
          "semantic_source": "protocol-layout",
          "access": [
            "self-read"
          ],
          "role": "request"
        },
        {
          "address": 18,
          "name": "RequestToken",
          "value_type": "integer",
          "semantic_source": "protocol-layout",
          "access": [
            "self-read"
          ],
          "role": "request_token"
        },
        {
          "address": 19,
          "name": "ResponseToken",
          "value_type": "integer",
          "semantic_source": "protocol-layout",
          "access": [
            "self-read",
            "self-write"
          ],
          "role": "response_token"
        },
        {
          "address": 20,
          "name": "Status",
          "value_type": "enum",
          "semantic_source": "protocol-layout",
          "access": [
            "self-write"
          ],
          "role": "state",
          "description": "1 satisfied, 2 lower-bound only, 3 deficit, -2 overflow, -1 invalid"
        },
        {
          "address": 21,
          "name": "InputOrdinal",
          "value_type": "number",
          "semantic_source": "protocol-layout",
          "access": [
            "self-write"
          ],
          "role": "result",
          "description": "the input the deficit was found on"
        },
        {
          "address": 22,
          "name": "InputResourceType",
          "value_type": "hash",
          "semantic_source": "protocol-layout",
          "access": [
            "self-write"
          ],
          "role": "result"
        },
        {
          "address": 23,
          "name": "RequiredTotal",
          "value_type": "number",
          "semantic_source": "protocol-layout",
          "access": [
            "self-write"
          ],
          "role": "result"
        },
        {
          "address": 24,
          "name": "QuotedTotal",
          "value_type": "number",
          "semantic_source": "protocol-layout",
          "access": [
            "self-write"
          ],
          "role": "result"
        },
        {
          "address": 25,
          "name": "Deficit",
          "value_type": "number",
          "semantic_source": "protocol-layout",
          "access": [
            "self-write"
          ],
          "role": "result"
        },
        {
          "address": 26,
          "name": "QuoteFingerprintA",
          "value_type": "number",
          "semantic_source": "protocol-layout",
          "access": [
            "self-write"
          ],
          "role": "result"
        },
        {
          "address": 27,
          "name": "QuoteFingerprintB",
          "value_type": "number",
          "semantic_source": "protocol-layout",
          "access": [
            "self-write"
          ],
          "role": "result"
        }
      ],
      "behavior": {
        "publication_rules": [],
        "restart": {
          "mode": "preserved-unless-overwritten",
          "source": "static-entry-path-analysis"
        },
        "invariants": [
          {
            "id": "header.s0.magic",
            "kind": "cell-equals",
            "address": 0,
            "equals": 1304257902,
            "source": "generated-protocol-header"
          },
          {
            "id": "header.s0.abi",
            "kind": "cell-equals",
            "address": 1,
            "equals": 1,
            "source": "generated-protocol-header"
          }
        ]
      }
    }
  ],
  "consumer_interfaces": []
}
