{
  "$schema": "../../schemas/protocol_definition.schema.json",
  "format": "IC10_PROTOCOL_DEFINITION_V1",
  "protocol_id": "ic10.stack.pressure-inventory-reservation.v1",
  "name": "PressureInventoryReservation v1",
  "transport": "ic-housing-stack",
  "contract": "PressureInventoryReservation",
  "magic": -920533037,
  "abi": 1,
  "header_bases": [
    0
  ],
  "canonical_refs": [],
  "layout": [
    {
      "cells": "S8",
      "start": 8,
      "end": 8,
      "name": "MolesPerKPa",
      "role": "result"
    },
    {
      "cells": "S9",
      "start": 9,
      "end": 9,
      "name": "MolesPerLiter",
      "role": "result"
    },
    {
      "cells": "S10",
      "start": 10,
      "end": 10,
      "name": "MirroredInventoryStatus",
      "role": "state"
    },
    {
      "cells": "S11",
      "start": 11,
      "end": 11,
      "name": "MirrorGeneration",
      "role": "generation"
    },
    {
      "cells": "S12",
      "start": 12,
      "end": 12,
      "name": "ReservedExportMoles",
      "role": "result",
      "description": "Allocator-owned"
    },
    {
      "cells": "S13",
      "start": 13,
      "end": 13,
      "name": "ReservedImportMoles",
      "role": "result",
      "description": "Allocator-owned"
    },
    {
      "cells": "S14",
      "start": 14,
      "end": 14,
      "name": "BuildEpoch",
      "role": "epoch",
      "description": "Allocator-owned"
    },
    {
      "cells": "S15",
      "start": 15,
      "end": 15,
      "name": "OwningPlannerRef",
      "role": "topology",
      "description": "Allocator-owned"
    },
    {
      "cells": "S16",
      "start": 16,
      "end": 16,
      "name": "InventoryRef",
      "role": "topology"
    },
    {
      "cells": "S17",
      "start": 17,
      "end": 17,
      "name": "PressureDomainRef",
      "role": "topology"
    },
    {
      "cells": "S18",
      "start": 18,
      "end": 18,
      "name": "Role",
      "role": "metadata",
      "description": "1 LOW, 2 HIGH, 3 STORAGE"
    },
    {
      "cells": "S19",
      "start": 19,
      "end": 19,
      "name": "MediumType",
      "role": "metadata"
    },
    {
      "cells": "S20",
      "start": 20,
      "end": 20,
      "name": "ExportableMoles",
      "role": "result"
    },
    {
      "cells": "S21",
      "start": 21,
      "end": 21,
      "name": "ImportCapacityMoles",
      "role": "result"
    }
  ],
  "provider_interfaces": [
    {
      "source": "ic10/pressure-grid/pressure_inventory_reservation_v1_1.ic10",
      "header_base": 0,
      "readable_ranges": [],
      "writable_ranges": [
        {
          "start": 12,
          "end": 15
        }
      ],
      "fields": [
        {
          "address": 0,
          "name": "Header@S0.Magic",
          "value_type": "hash",
          "semantic_source": "protocol-header",
          "access": [
            "self-write"
          ],
          "const": -920533037
        },
        {
          "address": 1,
          "name": "Header@S0.ABI",
          "value_type": "integer",
          "semantic_source": "protocol-header",
          "access": [
            "self-write"
          ],
          "const": 1
        },
        {
          "address": 2,
          "name": "S2",
          "value_type": "number",
          "semantic_source": "unresolved",
          "access": [
            "self-write"
          ],
          "const": 0
        },
        {
          "address": 8,
          "name": "MolesPerKPa",
          "value_type": "number",
          "semantic_source": "protocol-layout",
          "access": [
            "self-write"
          ],
          "role": "result"
        },
        {
          "address": 9,
          "name": "MolesPerLiter",
          "value_type": "number",
          "semantic_source": "protocol-layout",
          "access": [
            "self-write"
          ],
          "role": "result"
        },
        {
          "address": 10,
          "name": "MirroredInventoryStatus",
          "value_type": "enum",
          "semantic_source": "protocol-layout",
          "access": [
            "self-write"
          ],
          "role": "state"
        },
        {
          "address": 11,
          "name": "MirrorGeneration",
          "value_type": "integer",
          "semantic_source": "protocol-layout",
          "access": [
            "self-read",
            "self-write"
          ],
          "role": "generation"
        },
        {
          "address": 12,
          "name": "ReservedExportMoles",
          "value_type": "number",
          "semantic_source": "override",
          "access": [
            "external-read",
            "external-write",
            "self-write"
          ],
          "description": "Allocator-owned.",
          "role": "result"
        },
        {
          "address": 13,
          "name": "ReservedImportMoles",
          "value_type": "number",
          "semantic_source": "override",
          "access": [
            "external-read",
            "external-write",
            "self-write"
          ],
          "description": "Allocator-owned.",
          "role": "result"
        },
        {
          "address": 14,
          "name": "BuildEpoch",
          "value_type": "integer",
          "semantic_source": "override",
          "access": [
            "external-read",
            "external-write",
            "self-write"
          ],
          "description": "Allocator-owned.",
          "role": "epoch"
        },
        {
          "address": 15,
          "name": "OwningPlannerRef",
          "value_type": "number",
          "semantic_source": "override",
          "access": [
            "external-read",
            "external-write",
            "self-write"
          ],
          "description": "Allocator-owned.",
          "role": "topology"
        },
        {
          "address": 16,
          "name": "InventoryRef",
          "value_type": "number",
          "semantic_source": "protocol-layout",
          "access": [
            "self-write"
          ],
          "role": "topology"
        },
        {
          "address": 17,
          "name": "PressureDomainRef",
          "value_type": "number",
          "semantic_source": "protocol-layout",
          "access": [
            "self-write"
          ],
          "role": "topology"
        },
        {
          "address": 18,
          "name": "Role",
          "value_type": "number",
          "semantic_source": "protocol-layout",
          "access": [
            "self-write"
          ],
          "role": "metadata",
          "description": "1 LOW, 2 HIGH, 3 STORAGE"
        },
        {
          "address": 19,
          "name": "MediumType",
          "value_type": "hash",
          "semantic_source": "protocol-layout",
          "access": [
            "self-write"
          ],
          "role": "metadata"
        },
        {
          "address": 20,
          "name": "ExportableMoles",
          "value_type": "number",
          "semantic_source": "protocol-layout",
          "access": [
            "self-write"
          ],
          "role": "result"
        },
        {
          "address": 21,
          "name": "ImportCapacityMoles",
          "value_type": "integer",
          "semantic_source": "protocol-layout",
          "access": [
            "self-write"
          ],
          "role": "result"
        }
      ],
      "behavior": {
        "publication_rules": [],
        "restart": {
          "mode": "preserved-unless-overwritten",
          "source": "static-entry-path-analysis"
        },
        "invariants": [
          {
            "id": "header.s0.magic",
            "kind": "cell-equals",
            "address": 0,
            "equals": -920533037,
            "source": "generated-protocol-header"
          },
          {
            "id": "header.s0.abi",
            "kind": "cell-equals",
            "address": 1,
            "equals": 1,
            "source": "generated-protocol-header"
          }
        ]
      }
    }
  ],
  "consumer_interfaces": [
    {
      "source": "ic10/pressure-grid/controller_pressure_transfer_runtime_v2_0.ic10",
      "endpoint": {
        "kind": "device-port",
        "value": "d0"
      },
      "header_base": 0,
      "literal_reads": [
        0,
        8,
        9,
        11,
        18,
        19,
        20
      ],
      "literal_writes": [],
      "dynamic_read_ranges": [],
      "dynamic_write_ranges": [],
      "dynamic_read_range_source": "none",
      "dynamic_write_range_source": "none",
      "constraints": [
        {
          "address": 0,
          "operator": "equals",
          "value": -920533037
        }
      ],
      "publication_requirements": []
    },
    {
      "source": "ic10/pressure-grid/controller_pressure_transfer_runtime_v2_0.ic10",
      "endpoint": {
        "kind": "device-port",
        "value": "d1"
      },
      "header_base": 0,
      "literal_reads": [
        0,
        11,
        18,
        19,
        21
      ],
      "literal_writes": [],
      "dynamic_read_ranges": [],
      "dynamic_write_ranges": [],
      "dynamic_read_range_source": "none",
      "dynamic_write_range_source": "none",
      "constraints": [
        {
          "address": 0,
          "operator": "equals",
          "value": -920533037
        }
      ],
      "publication_requirements": []
    }
  ]
}
