{
  "$schema": "../../schemas/protocol_definition.schema.json",
  "format": "IC10_PROTOCOL_DEFINITION_V1",
  "protocol_id": "ic10.stack.pressure-domain-inventory.v2",
  "name": "PressureDomainInventory v2",
  "transport": "ic-housing-stack",
  "contract": "PressureDomainInventory",
  "magic": 205841631,
  "abi": 2,
  "header_bases": [
    0
  ],
  "canonical_refs": [],
  "layout": [
    {
      "cells": "S8",
      "start": 8,
      "end": 8,
      "name": "MolesPerLiter",
      "role": "result"
    },
    {
      "cells": "S9",
      "start": 9,
      "end": 9,
      "name": "TotalMoles",
      "role": "result"
    },
    {
      "cells": "S10",
      "start": 10,
      "end": 10,
      "name": "Pressure",
      "role": "result",
      "description": "kPa"
    },
    {
      "cells": "S11",
      "start": 11,
      "end": 11,
      "name": "Status",
      "role": "state",
      "description": "1 ready, negative fault"
    },
    {
      "cells": "S12",
      "start": 12,
      "end": 12,
      "name": "PublicationGeneration",
      "role": "generation",
      "description": "written last"
    },
    {
      "cells": "S13",
      "start": 13,
      "end": 13,
      "name": "PressureDomainRef",
      "role": "topology"
    },
    {
      "cells": "S14",
      "start": 14,
      "end": 14,
      "name": "Role",
      "role": "metadata",
      "description": "1 LOW, 2 HIGH, 3 STORAGE"
    },
    {
      "cells": "S15",
      "start": 15,
      "end": 15,
      "name": "MediumType",
      "role": "metadata"
    },
    {
      "cells": "S16",
      "start": 16,
      "end": 16,
      "name": "ExportableMoles",
      "role": "result"
    },
    {
      "cells": "S17",
      "start": 17,
      "end": 17,
      "name": "ImportCapacityMoles",
      "role": "result"
    },
    {
      "cells": "S18",
      "start": 18,
      "end": 18,
      "name": "MolesPerKPa",
      "role": "result"
    }
  ],
  "provider_interfaces": [
    {
      "source": "ic10/pressure-grid/pressure_domain_inventory_v1_1.ic10",
      "header_base": 0,
      "readable_ranges": [],
      "writable_ranges": [],
      "fields": [
        {
          "address": 0,
          "name": "Header@S0.Magic",
          "value_type": "hash",
          "semantic_source": "protocol-header",
          "access": [
            "self-write"
          ],
          "const": 205841631
        },
        {
          "address": 1,
          "name": "Header@S0.ABI",
          "value_type": "integer",
          "semantic_source": "protocol-header",
          "access": [
            "self-write"
          ],
          "const": 2
        },
        {
          "address": 2,
          "name": "S2",
          "value_type": "number",
          "semantic_source": "unresolved",
          "access": [
            "self-write"
          ],
          "const": 0
        },
        {
          "address": 8,
          "name": "MolesPerLiter",
          "value_type": "number",
          "semantic_source": "protocol-layout",
          "access": [
            "self-write"
          ],
          "role": "result"
        },
        {
          "address": 9,
          "name": "TotalMoles",
          "value_type": "number",
          "semantic_source": "protocol-layout",
          "access": [
            "self-write"
          ],
          "role": "result"
        },
        {
          "address": 10,
          "name": "Pressure",
          "value_type": "number",
          "semantic_source": "protocol-layout",
          "access": [
            "self-write"
          ],
          "role": "result",
          "description": "kPa"
        },
        {
          "address": 11,
          "name": "Status",
          "value_type": "enum",
          "semantic_source": "protocol-layout",
          "access": [
            "self-write"
          ],
          "role": "state",
          "description": "1 ready, negative fault"
        },
        {
          "address": 12,
          "name": "PublicationGeneration",
          "value_type": "integer",
          "semantic_source": "protocol-layout",
          "access": [
            "self-read",
            "self-write"
          ],
          "role": "generation",
          "description": "written last"
        },
        {
          "address": 13,
          "name": "PressureDomainRef",
          "value_type": "number",
          "semantic_source": "protocol-layout",
          "access": [
            "self-write"
          ],
          "role": "topology"
        },
        {
          "address": 14,
          "name": "Role",
          "value_type": "number",
          "semantic_source": "protocol-layout",
          "access": [
            "self-write"
          ],
          "role": "metadata",
          "description": "1 LOW, 2 HIGH, 3 STORAGE"
        },
        {
          "address": 15,
          "name": "MediumType",
          "value_type": "hash",
          "semantic_source": "protocol-layout",
          "access": [
            "self-write"
          ],
          "role": "metadata"
        },
        {
          "address": 16,
          "name": "ExportableMoles",
          "value_type": "number",
          "semantic_source": "protocol-layout",
          "access": [
            "self-write"
          ],
          "role": "result"
        },
        {
          "address": 17,
          "name": "ImportCapacityMoles",
          "value_type": "integer",
          "semantic_source": "protocol-layout",
          "access": [
            "self-write"
          ],
          "role": "result"
        },
        {
          "address": 18,
          "name": "MolesPerKPa",
          "value_type": "number",
          "semantic_source": "protocol-layout",
          "access": [
            "self-write"
          ],
          "role": "result"
        }
      ],
      "behavior": {
        "publication_rules": [],
        "restart": {
          "mode": "preserved-unless-overwritten",
          "source": "static-entry-path-analysis"
        },
        "invariants": [
          {
            "id": "header.s0.magic",
            "kind": "cell-equals",
            "address": 0,
            "equals": 205841631,
            "source": "generated-protocol-header"
          },
          {
            "id": "header.s0.abi",
            "kind": "cell-equals",
            "address": 1,
            "equals": 2,
            "source": "generated-protocol-header"
          }
        ]
      }
    }
  ],
  "consumer_interfaces": [
    {
      "source": "ic10/pressure-grid/pressure_inventory_reservation_v1_1.ic10",
      "endpoint": {
        "kind": "device-port",
        "value": "d0"
      },
      "header_base": 0,
      "literal_reads": [
        0,
        8,
        11,
        12,
        13,
        14,
        15,
        16,
        17,
        18
      ],
      "literal_writes": [],
      "dynamic_read_ranges": [],
      "dynamic_write_ranges": [],
      "dynamic_read_range_source": "none",
      "dynamic_write_range_source": "none",
      "constraints": [
        {
          "address": 0,
          "operator": "equals",
          "value": 205841631
        }
      ],
      "publication_requirements": []
    },
    {
      "source": "ic10/resource-grid-core/pressure_resource_endpoint_adapter_v1_0.ic10",
      "endpoint": {
        "kind": "device-port",
        "value": "d0"
      },
      "header_base": 0,
      "literal_reads": [
        0,
        11,
        12,
        14,
        15,
        16,
        17
      ],
      "literal_writes": [],
      "dynamic_read_ranges": [],
      "dynamic_write_ranges": [],
      "dynamic_read_range_source": "none",
      "dynamic_write_range_source": "none",
      "constraints": [
        {
          "address": 0,
          "operator": "equals",
          "value": 205841631
        }
      ],
      "publication_requirements": []
    }
  ]
}
