{
  "$schema": "../../schemas/protocol_definition.schema.json",
  "format": "IC10_PROTOCOL_DEFINITION_V1",
  "protocol_id": "ic10.stack.sequencer-config-policy.v1",
  "name": "SequencerConfigPolicy v1",
  "transport": "ic-housing-stack",
  "contract": "SequencerConfigPolicy",
  "magic": -1365700536,
  "abi": 1,
  "header_bases": [
    0
  ],
  "canonical_refs": [],
  "layout": [],
  "provider_interfaces": [
    {
      "source": "ic10/controller-sequencer/sequencer_config_policy_v1_0.ic10",
      "header_base": 0,
      "readable_ranges": [],
      "writable_ranges": [],
      "fields": [
        {
          "address": 0,
          "name": "Header@S0.Magic",
          "value_type": "hash",
          "semantic_source": "protocol-header",
          "access": [
            "self-write"
          ],
          "const": -1365700536
        },
        {
          "address": 1,
          "name": "Header@S0.ABI",
          "value_type": "integer",
          "semantic_source": "protocol-header",
          "access": [
            "self-write"
          ],
          "const": 1
        },
        {
          "address": 2,
          "name": "S2",
          "value_type": "number",
          "semantic_source": "unresolved",
          "access": [
            "self-write"
          ],
          "const": 32
        }
      ],
      "behavior": {
        "publication_rules": [],
        "restart": {
          "mode": "preserved-unless-overwritten",
          "source": "static-entry-path-analysis"
        },
        "invariants": [
          {
            "id": "header.s0.magic",
            "kind": "cell-equals",
            "address": 0,
            "equals": -1365700536,
            "source": "generated-protocol-header"
          },
          {
            "id": "header.s0.abi",
            "kind": "cell-equals",
            "address": 1,
            "equals": 1,
            "source": "generated-protocol-header"
          }
        ]
      }
    }
  ],
  "consumer_interfaces": []
}
