{
  "$schema": "../../schemas/protocol_definition.schema.json",
  "format": "IC10_PROTOCOL_DEFINITION_V1",
  "protocol_id": "ic10.stack.resource-reservation-releaser.v1",
  "name": "ResourceReservationReleaser v1",
  "transport": "ic-housing-stack",
  "contract": "ResourceReservationReleaser",
  "magic": 1817554583,
  "abi": 1,
  "header_bases": [
    0
  ],
  "canonical_refs": [],
  "layout": [
    {
      "cells": "S8",
      "start": 8,
      "end": 8,
      "name": "OwnerEpoch",
      "role": "request"
    },
    {
      "cells": "S9",
      "start": 9,
      "end": 9,
      "name": "RequestToken",
      "role": "request_token"
    },
    {
      "cells": "S10",
      "start": 10,
      "end": 10,
      "name": "ResponseToken",
      "role": "response_token"
    },
    {
      "cells": "S11",
      "start": 11,
      "end": 11,
      "name": "Status",
      "role": "state"
    }
  ],
  "provider_interfaces": [
    {
      "source": "ic10/resource-grid-core/resource_reservation_releaser_v1_0.ic10",
      "header_base": 0,
      "readable_ranges": [],
      "writable_ranges": [],
      "fields": [
        {
          "address": 0,
          "name": "Header@S0.Magic",
          "value_type": "hash",
          "semantic_source": "protocol-header",
          "access": [
            "self-write"
          ],
          "const": 1817554583
        },
        {
          "address": 1,
          "name": "Header@S0.ABI",
          "value_type": "integer",
          "semantic_source": "protocol-header",
          "access": [
            "self-write"
          ],
          "const": 1
        },
        {
          "address": 2,
          "name": "S2",
          "value_type": "number",
          "semantic_source": "unresolved",
          "access": [
            "self-write"
          ],
          "const": 32
        },
        {
          "address": 8,
          "name": "OwnerEpoch",
          "value_type": "integer",
          "semantic_source": "protocol-layout",
          "access": [
            "self-read"
          ],
          "role": "request"
        },
        {
          "address": 9,
          "name": "RequestToken",
          "value_type": "integer",
          "semantic_source": "protocol-layout",
          "access": [
            "self-read"
          ],
          "role": "request_token"
        },
        {
          "address": 10,
          "name": "ResponseToken",
          "value_type": "integer",
          "semantic_source": "protocol-layout",
          "access": [
            "self-read",
            "self-write"
          ],
          "role": "response_token"
        },
        {
          "address": 11,
          "name": "Status",
          "value_type": "enum",
          "semantic_source": "protocol-layout",
          "access": [
            "self-write"
          ],
          "role": "state"
        },
        {
          "address": 12,
          "name": "S12",
          "value_type": "number",
          "semantic_source": "unresolved",
          "access": [
            "self-write"
          ]
        }
      ],
      "behavior": {
        "publication_rules": [],
        "restart": {
          "mode": "preserved-unless-overwritten",
          "source": "static-entry-path-analysis"
        },
        "invariants": [
          {
            "id": "header.s0.magic",
            "kind": "cell-equals",
            "address": 0,
            "equals": 1817554583,
            "source": "generated-protocol-header"
          },
          {
            "id": "header.s0.abi",
            "kind": "cell-equals",
            "address": 1,
            "equals": 1,
            "source": "generated-protocol-header"
          }
        ]
      }
    }
  ],
  "consumer_interfaces": []
}
