{
  "$schema": "../../schemas/protocol_definition.schema.json",
  "format": "IC10_PROTOCOL_DEFINITION_V1",
  "protocol_id": "ic10.stack.catalog-coordinator-recovery.v2",
  "name": "CatalogCoordinatorRecovery v2",
  "transport": "ic-housing-stack",
  "contract": "CatalogCoordinatorRecovery",
  "magic": -1361483816,
  "abi": 2,
  "header_bases": [
    0
  ],
  "canonical_refs": [],
  "layout": [],
  "provider_interfaces": [
    {
      "source": "ic10/catalog-control-plane/catalog_coordinator_recovery_v2_0.ic10",
      "header_base": 0,
      "readable_ranges": [],
      "writable_ranges": [],
      "fields": [
        {
          "address": 0,
          "name": "Header@S0.Magic",
          "value_type": "hash",
          "semantic_source": "protocol-header",
          "access": [
            "self-write"
          ],
          "const": -1361483816
        },
        {
          "address": 1,
          "name": "Header@S0.ABI",
          "value_type": "integer",
          "semantic_source": "protocol-header",
          "access": [
            "self-write"
          ],
          "const": 2
        },
        {
          "address": 2,
          "name": "S2",
          "value_type": "number",
          "semantic_source": "unresolved",
          "access": [
            "self-write"
          ],
          "const": 0
        },
        {
          "address": 8,
          "name": "S8",
          "value_type": "number",
          "semantic_source": "unresolved",
          "access": [
            "self-read",
            "self-write"
          ]
        }
      ],
      "behavior": {
        "publication_rules": [],
        "restart": {
          "mode": "preserved-unless-overwritten",
          "source": "static-entry-path-analysis"
        },
        "invariants": [
          {
            "id": "header.s0.magic",
            "kind": "cell-equals",
            "address": 0,
            "equals": -1361483816,
            "source": "generated-protocol-header"
          },
          {
            "id": "header.s0.abi",
            "kind": "cell-equals",
            "address": 1,
            "equals": 2,
            "source": "generated-protocol-header"
          }
        ]
      }
    }
  ],
  "consumer_interfaces": []
}
