{
  "$schema": "../../schemas/protocol_definition.schema.json",
  "format": "IC10_PROTOCOL_DEFINITION_V1",
  "protocol_id": "ic10.stack.stack-header-reader.v1",
  "name": "StackHeaderReader v1",
  "transport": "ic-housing-stack",
  "contract": "StackHeaderReader",
  "magic": 2031952084,
  "abi": 1,
  "header_bases": [
    0
  ],
  "canonical_refs": [],
  "layout": [],
  "provider_interfaces": [
    {
      "source": "ic10/live-commissioning/stack_header_reader_v1_0.ic10",
      "header_base": 0,
      "readable_ranges": [],
      "writable_ranges": [],
      "fields": [
        {
          "address": 0,
          "name": "Header@S0.Magic",
          "value_type": "hash",
          "semantic_source": "protocol-header",
          "access": [
            "self-write"
          ],
          "const": 2031952084
        },
        {
          "address": 1,
          "name": "Header@S0.ABI",
          "value_type": "integer",
          "semantic_source": "protocol-header",
          "access": [
            "self-write"
          ],
          "const": 1
        },
        {
          "address": 2,
          "name": "S2",
          "value_type": "number",
          "semantic_source": "unresolved",
          "access": [
            "self-write"
          ],
          "const": 20
        },
        {
          "address": 5,
          "name": "S5",
          "value_type": "number",
          "semantic_source": "unresolved",
          "access": [
            "self-write"
          ]
        },
        {
          "address": 7,
          "name": "S7",
          "value_type": "number",
          "semantic_source": "source",
          "access": [
            "self-read",
            "self-write"
          ],
          "description": "complete header sample publishes LAST"
        },
        {
          "address": 8,
          "name": "S8",
          "value_type": "number",
          "semantic_source": "unresolved",
          "access": [
            "self-write"
          ]
        },
        {
          "address": 9,
          "name": "S9",
          "value_type": "number",
          "semantic_source": "unresolved",
          "access": [
            "self-write"
          ]
        },
        {
          "address": 10,
          "name": "S10",
          "value_type": "number",
          "semantic_source": "unresolved",
          "access": [
            "self-write"
          ]
        },
        {
          "address": 11,
          "name": "S11",
          "value_type": "number",
          "semantic_source": "unresolved",
          "access": [
            "self-write"
          ]
        },
        {
          "address": 12,
          "name": "S12",
          "value_type": "number",
          "semantic_source": "unresolved",
          "access": [
            "self-write"
          ]
        },
        {
          "address": 13,
          "name": "S13",
          "value_type": "number",
          "semantic_source": "unresolved",
          "access": [
            "self-write"
          ]
        },
        {
          "address": 14,
          "name": "S14",
          "value_type": "number",
          "semantic_source": "unresolved",
          "access": [
            "self-write"
          ]
        },
        {
          "address": 15,
          "name": "S15",
          "value_type": "number",
          "semantic_source": "unresolved",
          "access": [
            "self-write"
          ]
        },
        {
          "address": 16,
          "name": "S16",
          "value_type": "number",
          "semantic_source": "unresolved",
          "access": [
            "self-write"
          ]
        },
        {
          "address": 17,
          "name": "S17",
          "value_type": "number",
          "semantic_source": "unresolved",
          "access": [
            "self-write"
          ]
        }
      ],
      "behavior": {
        "publication_rules": [
          {
            "kind": "commit-last",
            "address": 7,
            "description": "complete header sample publishes LAST",
            "source": "verified-inline-order"
          }
        ],
        "restart": {
          "mode": "preserved-unless-overwritten",
          "source": "static-entry-path-analysis"
        },
        "invariants": [
          {
            "id": "header.s0.magic",
            "kind": "cell-equals",
            "address": 0,
            "equals": 2031952084,
            "source": "generated-protocol-header"
          },
          {
            "id": "header.s0.abi",
            "kind": "cell-equals",
            "address": 1,
            "equals": 1,
            "source": "generated-protocol-header"
          }
        ]
      }
    }
  ],
  "consumer_interfaces": []
}
